{
  "$schema": "https://parallelslices.com/schemas/architecture-package-authoring.schema.json",
  "version": 1,
  "id": "company-web-app",
  "packageName": "@example/parallel-slices-company-web-app",
  "packageVersion": "0.1.0",
  "displayName": "Company web application",
  "description": "A company-owned web application architecture with reviewed internal platform conventions.",
  "defaultProfile": "external-api-only",
  "components": [
    {
      "id": "web-application",
      "kind": "application",
      "technology": "Company web platform",
      "attributes": {
        "formFactor": "web"
      }
    }
  ],
  "capabilities": ["application:web", "data:external-api"]
}
